{
  "schemaVersion": 1,
  "sdk": "plaits-engine-cpp-v1",
  "packageType": "builtin-reference",
  "id": "rubato/skins",
  "catalogId": "skins",
  "version": "0.1.0",
  "name": "Skins",
  "author": "Lyle Mills",
  "origin": "Rubato Lab",
  "license": "MIT",
  "description": "Struck membrane modes move from a round open head to a tighter loaded skin, with centre, rim, damping and pitch-dive control.",
  "family": "Percussion",
  "tags": ["drum", "hand drum", "membrane", "modal", "percussion", "physical"],
  "controls": [
    { "id": "harmonics", "label": "Membrane", "description": "Retensions the mode ratios from a round open head toward a tighter loaded skin." },
    { "id": "timbre", "label": "Strike", "description": "Moves the strike from the centre's low body toward a bright rim slap." },
    { "id": "morph", "label": "Damping", "description": "Opens the head from a short muted knock to a long resonant ring." },
    { "id": "macro", "label": "Pressure", "description": "Adds hand pressure: stronger pitch dive and faster loss of the upper modes." }
  ],
  "outputs": { "main": "Mono: the full membrane and strike. Stereo: the left membrane pickup.", "aux": "Mono: rim-weighted upper modes and dry slap. Stereo: the right membrane pickup." },
  "source": {
    "root": "../../../../..",
    "header": "plaits/dsp/engine2/skins_engine.h",
    "files": ["plaits/dsp/engine2/skins_engine.cc"],
    "className": "SkinsEngine"
  },
  "postProcessing": { "alreadyEnveloped": true, "outGain": 0.9, "auxGain": 0.9 },
  "scenarios": "tests/scenarios.json",
  "upstream": "Original Rubato Lab prototype"
}
