{
  "schemaVersion": 1,
  "sdk": "plaits-engine-cpp-v1",
  "packageType": "builtin-reference",
  "id": "mutable-instruments/virtual-analog-crossfade",
  "catalogId": "virtual-analog-crossfade",
  "version": "1.0.0",
  "name": "Virtual Analog Crossfade",
  "author": "Emilie Gillet",
  "origin": "Mutable Instruments",
  "license": "MIT",
  "description": "Emilie Gillet's original virtual-analog variant 1: a detuned pair crossfading through dry tone into hard sync.",
  "family": "Subtractive",
  "tags": ["analog", "oscillator", "sync"],
  "controls": [
    { "id": "harmonics", "label": "Detune", "description": "Detunes the secondary oscillator through musical intervals." },
    { "id": "timbre", "label": "Detune to sync", "description": "Moves from the detuned pair through the dry primary to hard synchronization." },
    { "id": "morph", "label": "Common waveform", "description": "Changes all oscillator paths through the same variable waveform range." },
    { "id": "macro", "label": "Detune range", "description": "Scales interval detuning around the original range at its midpoint." }
  ],
  "outputs": {
    "main": "Crossfade from the detuned pair through the dry primary to its synchronized form.",
    "aux": "The detuned secondary oscillator."
  },
  "source": {
    "root": "../../../../..",
    "header": "plaits/dsp/engine/virtual_analog_crossfade_engine.h",
    "files": ["plaits/dsp/engine/virtual_analog_crossfade_engine.cc"],
    "className": "VirtualAnalogCrossfadeEngine"
  },
  "postProcessing": { "alreadyEnveloped": false, "outGain": 0.8, "auxGain": 0.8 },
  "scenarios": "tests/scenarios.json",
  "upstream": "Mutable Instruments eurorack Plaits source, original VA_VARIANT 1 with Plaits Palette macro and stereo integration"
}
