{
  "schemaVersion": 1,
  "sdk": "plaits-engine-cpp-v1",
  "packageType": "builtin-reference",
  "id": "mutable-instruments/wave-paraphonic",
  "catalogId": "wave-paraphonic",
  "version": "1.0.0",
  "name": "Wave Paraphonic",
  "author": "Emilie Gillet",
  "origin": "Mutable Instruments",
  "license": "MIT",
  "description": "Four wavetable voices play the active Plaits chord table over Braids' 33-wave scan line, with per-voice wave fan and continuous interval scaling.",
  "family": "Polyphonic",
  "tags": [
    "braids",
    "wavetable",
    "chord",
    "paraphonic"
  ],
  "controls": [
    {
      "id": "harmonics",
      "label": "Chord",
      "description": "Selects a position in the active chord table."
    },
    {
      "id": "timbre",
      "label": "Wave",
      "description": "Scans the 33-wave line all four voices read, crossfading between neighbours."
    },
    {
      "id": "morph",
      "label": "Fan",
      "description": "Offsets each voice further along the scan line, so the four read different waves."
    },
    {
      "id": "macro",
      "label": "Spread",
      "description": "Scales every table interval, from a unison at zero through the table verbatim at noon to double width."
    }
  ],
  "outputs": {
    "main": "Mono: all four chord voices summed. Stereo: the left side of the fixed four-voice pan spread.",
    "aux": "Mono: the chord table's first voice alone. Stereo: the right side of the four-voice pan spread."
  },
  "trigger": "Randomizes all four wavetable phases and snaps their frequencies to the current chord.",
  "sharedModules": [
    "chord-bank"
  ],
  "source": {
    "root": "../../../../..",
    "header": "plaits/dsp/engine2/wave_paraphonic_engine.h",
    "files": [
      "plaits/dsp/engine2/wave_paraphonic_engine.cc"
    ],
    "className": "WaveParaphonicEngine"
  },
  "postProcessing": {
    "alreadyEnveloped": false,
    "outGain": 0.8,
    "auxGain": 0.8
  },
  "scenarios": "tests/scenarios.json",
  "upstream": "Braids DigitalOscillator::RenderWaveParaphonic"
}
